{
  "_WARNING": "This file was generated by the 'dotnet sqlsource' tool.  Do not edit by hand; use the tool to regenerate it.",
  "$schema": "https://raw.githubusercontent.com/mbcrawfo/SqlSource/main/schemas/sidecar-v1.schema.json",
  "formatVersion": 1,
  "toolVersion": "0.1.0",
  "queries": {
    "ListCustomersWithLatestOrder": {
      "hash": "da2084978876cbf9c1d3b5b675a39b5909437d0d9d84171dc8583d0b6e505723",
      "engine": "mssql",
      "database": "realistic",
      "serverVersion": "17.0.5015.4",
      "resultKind": "rows",
      "matchesTable": null,
      "plan": "skipped",
      "tableMatch": "several-tables",
      "parameters": [],
      "columns": [
        {
          "ordinal": 0,
          "name": "id",
          "type": {
            "name": "int",
            "maxLength": 4,
            "precision": 10,
            "scale": 0
          },
          "nullable": false,
          "nullableSource": "server",
          "origin": {
            "schema": "dbo",
            "table": "customers",
            "column": "id"
          },
          "identity": true,
          "computed": false
        },
        {
          "ordinal": 1,
          "name": "name",
          "type": {
            "name": "nvarchar(100)",
            "maxLength": 200,
            "precision": 0,
            "scale": 0
          },
          "nullable": false,
          "nullableSource": "server",
          "origin": {
            "schema": "dbo",
            "table": "customers",
            "column": "name"
          },
          "identity": false,
          "computed": false
        },
        {
          "ordinal": 2,
          "name": "email",
          "type": {
            "name": "nvarchar(254)",
            "maxLength": 508,
            "precision": 0,
            "scale": 0,
            "userType": {
              "schema": "dbo",
              "name": "Email"
            }
          },
          "nullable": true,
          "nullableSource": "server",
          "origin": {
            "schema": "dbo",
            "table": "customers",
            "column": "email"
          },
          "identity": false,
          "computed": false
        },
        {
          "ordinal": 3,
          "name": "order_id",
          "type": {
            "name": "int",
            "maxLength": 4,
            "precision": 10,
            "scale": 0
          },
          "nullable": false,
          "nullableSource": "server",
          "origin": {
            "schema": "dbo",
            "table": "orders",
            "column": "id"
          },
          "identity": true,
          "computed": false
        },
        {
          "ordinal": 4,
          "name": "placed_at",
          "type": {
            "name": "datetime2(0)",
            "maxLength": 6,
            "precision": 19,
            "scale": 0
          },
          "nullable": false,
          "nullableSource": "server",
          "origin": {
            "schema": "dbo",
            "table": "orders",
            "column": "placed_at"
          },
          "identity": false,
          "computed": false
        },
        {
          "ordinal": 5,
          "name": "status",
          "type": {
            "name": "varchar(10)",
            "maxLength": 10,
            "precision": 0,
            "scale": 0
          },
          "nullable": false,
          "nullableSource": "server",
          "origin": {
            "schema": "dbo",
            "table": "orders",
            "column": "status"
          },
          "identity": false,
          "computed": false
        },
        {
          "ordinal": 6,
          "name": "ship_city",
          "type": {
            "name": "nvarchar(50)",
            "maxLength": 100,
            "precision": 0,
            "scale": 0
          },
          "nullable": true,
          "nullableSource": "server",
          "origin": {
            "schema": "dbo",
            "table": "orders",
            "column": "ship_city"
          },
          "identity": false,
          "computed": false
        },
        {
          "ordinal": 7,
          "name": "shipped_at",
          "type": {
            "name": "datetime2(0)",
            "maxLength": 6,
            "precision": 19,
            "scale": 0
          },
          "nullable": true,
          "nullableSource": "server",
          "origin": {
            "schema": "dbo",
            "table": "orders",
            "column": "shipped_at"
          },
          "identity": false,
          "computed": false
        }
      ]
    }
  }
}
