{
  "_WARNING": "This file was generated by the 'dotnet sqlsource' tool.  Do not edit by hand; use the tool to regenerate it.",
  "$schema": "https://raw.githubusercontent.com/mbcrawfo/SqlSource/main/schemas/sidecar-v1.schema.json",
  "formatVersion": 1,
  "toolVersion": "0.1.0",
  "queries": {
    "ListShippingOptions": {
      "hash": "5c64018e652e06e2253b87357638a9cff21b00519a8a3211432513da108a58fc",
      "engine": "postgres",
      "database": "realistic",
      "serverVersion": "18.6",
      "resultKind": "rows",
      "matchesTable": null,
      "plan": "walked",
      "tableMatch": "no-origin",
      "parameters": [],
      "columns": [
        {
          "ordinal": 0,
          "name": "column1",
          "type": {
            "name": "text",
            "kind": "base",
            "schema": "pg_catalog",
            "internalName": "text"
          },
          "nullable": null,
          "nullableSource": "no-origin",
          "origin": null,
          "identity": null,
          "computed": null
        },
        {
          "ordinal": 1,
          "name": "column2",
          "type": {
            "name": "text",
            "kind": "base",
            "schema": "pg_catalog",
            "internalName": "text"
          },
          "nullable": null,
          "nullableSource": "no-origin",
          "origin": null,
          "identity": null,
          "computed": null
        },
        {
          "ordinal": 2,
          "name": "column3",
          "type": {
            "name": "numeric",
            "kind": "base",
            "schema": "pg_catalog",
            "internalName": "numeric"
          },
          "nullable": null,
          "nullableSource": "no-origin",
          "origin": null,
          "identity": null,
          "computed": null
        },
        {
          "ordinal": 3,
          "name": "column4",
          "type": {
            "name": "integer",
            "kind": "base",
            "schema": "pg_catalog",
            "internalName": "int4"
          },
          "nullable": null,
          "nullableSource": "no-origin",
          "origin": null,
          "identity": null,
          "computed": null
        }
      ]
    }
  }
}
