{
  "_WARNING": "This file was generated by the 'dotnet sqlsource' tool.  Do not edit by hand; use the tool to regenerate it.",
  "$schema": "https://raw.githubusercontent.com/mbcrawfo/SqlSource/main/schemas/sidecar-v1.schema.json",
  "formatVersion": 1,
  "toolVersion": "0.1.0",
  "queries": {
    "ImportProducts": {
      "hash": "db781fc799232310aa4b959f8c645ac25ddf4c4505e3ab0e4a68374efb4028ed",
      "engine": "postgres",
      "database": "realistic",
      "serverVersion": "18.6",
      "resultKind": "rows",
      "matchesTable": null,
      "plan": "walked",
      "tableMatch": "order-differs",
      "parameters": [
        {
          "name": "ids",
          "ordinal": 0,
          "type": {
            "name": "integer[]",
            "bindName": "integer[]",
            "kind": "array",
            "schema": "pg_catalog",
            "internalName": "_int4",
            "element": {
              "name": "integer",
              "kind": "base",
              "schema": "pg_catalog",
              "internalName": "int4"
            }
          },
          "nullable": null,
          "typeSource": "inferred"
        },
        {
          "name": "skus",
          "ordinal": 1,
          "type": {
            "name": "text[]",
            "bindName": "text[]",
            "kind": "array",
            "schema": "pg_catalog",
            "internalName": "_text",
            "element": {
              "name": "text",
              "kind": "base",
              "schema": "pg_catalog",
              "internalName": "text"
            }
          },
          "nullable": null,
          "typeSource": "inferred"
        },
        {
          "name": "names",
          "ordinal": 2,
          "type": {
            "name": "text[]",
            "bindName": "text[]",
            "kind": "array",
            "schema": "pg_catalog",
            "internalName": "_text",
            "element": {
              "name": "text",
              "kind": "base",
              "schema": "pg_catalog",
              "internalName": "text"
            }
          },
          "nullable": null,
          "typeSource": "inferred"
        },
        {
          "name": "prices",
          "ordinal": 3,
          "type": {
            "name": "numeric[]",
            "bindName": "numeric[]",
            "kind": "array",
            "schema": "pg_catalog",
            "internalName": "_numeric",
            "element": {
              "name": "numeric",
              "kind": "base",
              "schema": "pg_catalog",
              "internalName": "numeric"
            }
          },
          "nullable": null,
          "typeSource": "inferred"
        },
        {
          "name": "category_slugs",
          "ordinal": 4,
          "type": {
            "name": "text[]",
            "bindName": "text[]",
            "kind": "array",
            "schema": "pg_catalog",
            "internalName": "_text",
            "element": {
              "name": "text",
              "kind": "base",
              "schema": "pg_catalog",
              "internalName": "text"
            }
          },
          "nullable": null,
          "typeSource": "inferred"
        }
      ],
      "columns": [
        {
          "ordinal": 0,
          "name": "id",
          "type": {
            "name": "integer",
            "kind": "base",
            "schema": "pg_catalog",
            "internalName": "int4"
          },
          "nullable": false,
          "nullableSource": "catalog",
          "origin": {
            "schema": "public",
            "table": "products",
            "column": "id"
          },
          "identity": false,
          "computed": false
        },
        {
          "ordinal": 1,
          "name": "sku",
          "type": {
            "name": "text",
            "kind": "base",
            "schema": "pg_catalog",
            "internalName": "text"
          },
          "nullable": false,
          "nullableSource": "catalog",
          "origin": {
            "schema": "public",
            "table": "products",
            "column": "sku"
          },
          "identity": false,
          "computed": false
        },
        {
          "ordinal": 2,
          "name": "name",
          "type": {
            "name": "text",
            "kind": "base",
            "schema": "pg_catalog",
            "internalName": "text"
          },
          "nullable": false,
          "nullableSource": "catalog",
          "origin": {
            "schema": "public",
            "table": "products",
            "column": "name"
          },
          "identity": false,
          "computed": false
        },
        {
          "ordinal": 3,
          "name": "price",
          "type": {
            "name": "numeric(12,2)",
            "kind": "base",
            "schema": "pg_catalog",
            "internalName": "numeric",
            "precision": 12,
            "scale": 2
          },
          "nullable": false,
          "nullableSource": "catalog",
          "origin": {
            "schema": "public",
            "table": "products",
            "column": "price"
          },
          "identity": false,
          "computed": false
        },
        {
          "ordinal": 4,
          "name": "category_id",
          "type": {
            "name": "integer",
            "kind": "base",
            "schema": "pg_catalog",
            "internalName": "int4"
          },
          "nullable": true,
          "nullableSource": "catalog",
          "origin": {
            "schema": "public",
            "table": "products",
            "column": "category_id"
          },
          "identity": false,
          "computed": false
        },
        {
          "ordinal": 5,
          "name": "discontinued_on",
          "type": {
            "name": "date",
            "kind": "base",
            "schema": "pg_catalog",
            "internalName": "date"
          },
          "nullable": true,
          "nullableSource": "catalog",
          "origin": {
            "schema": "public",
            "table": "products",
            "column": "discontinued_on"
          },
          "identity": false,
          "computed": false
        }
      ]
    }
  }
}
