{
  "_WARNING": "This file was generated by the 'dotnet sqlsource' tool.  Do not edit by hand; use the tool to regenerate it.",
  "$schema": "https://raw.githubusercontent.com/mbcrawfo/SqlSource/main/schemas/sidecar-v1.schema.json",
  "formatVersion": 1,
  "toolVersion": "0.1.0",
  "queries": {
    "ListInvoicedBuyers": {
      "hash": "4f612bfe3758bb3a0fce4aa798eed0a4b9e7de40381f6459b6913c9fb4784f87",
      "engine": "postgres",
      "database": "realistic",
      "serverVersion": "18.6",
      "resultKind": "rows",
      "matchesTable": null,
      "plan": "walked",
      "tableMatch": "no-origin",
      "parameters": [
        {
          "name": "min_amount",
          "ordinal": 0,
          "type": {
            "name": "numeric",
            "bindName": "numeric",
            "kind": "base",
            "schema": "pg_catalog",
            "internalName": "numeric"
          },
          "nullable": null,
          "typeSource": "declared"
        },
        {
          "name": "limit",
          "ordinal": 1,
          "type": {
            "name": "bigint",
            "bindName": "bigint",
            "kind": "base",
            "schema": "pg_catalog",
            "internalName": "int8"
          },
          "nullable": null,
          "typeSource": "inferred"
        }
      ],
      "columns": [
        {
          "ordinal": 0,
          "name": "id",
          "type": {
            "name": "integer",
            "kind": "base",
            "schema": "pg_catalog",
            "internalName": "int4"
          },
          "nullable": false,
          "nullableSource": "catalog",
          "origin": {
            "schema": "public",
            "table": "accounts",
            "column": "id"
          },
          "identity": true,
          "computed": false
        },
        {
          "ordinal": 1,
          "name": "name",
          "type": {
            "name": "character varying(100)",
            "kind": "base",
            "schema": "pg_catalog",
            "internalName": "varchar",
            "length": 100
          },
          "nullable": false,
          "nullableSource": "catalog",
          "origin": {
            "schema": "public",
            "table": "accounts",
            "column": "name"
          },
          "identity": false,
          "computed": false
        },
        {
          "ordinal": 2,
          "name": "email",
          "type": {
            "name": "public.email_t",
            "kind": "domain",
            "schema": "public",
            "internalName": "email_t",
            "base": {
              "name": "text",
              "kind": "base",
              "schema": "pg_catalog",
              "internalName": "text"
            }
          },
          "nullable": true,
          "nullableSource": "catalog",
          "origin": {
            "schema": "public",
            "table": "accounts",
            "column": "email"
          },
          "identity": false,
          "computed": false
        },
        {
          "ordinal": 3,
          "name": "theme",
          "type": {
            "name": "text",
            "kind": "base",
            "schema": "pg_catalog",
            "internalName": "text"
          },
          "nullable": null,
          "nullableSource": "no-origin",
          "origin": null,
          "identity": null,
          "computed": null
        }
      ]
    }
  }
}
