{
  "_WARNING": "This file was generated by the 'dotnet sqlsource' tool.  Do not edit by hand; use the tool to regenerate it.",
  "$schema": "https://raw.githubusercontent.com/mbcrawfo/SqlSource/main/schemas/sidecar-v1.schema.json",
  "formatVersion": 1,
  "toolVersion": "0.1.0",
  "queries": {
    "GetCart": {
      "hash": "39c22ffb686214623ede532e00c90a6832b1e30de1fd1623580cfc418684b03e",
      "engine": "mssql",
      "database": "realistic",
      "serverVersion": "17.0.5015.4",
      "resultKind": "rows",
      "matchesTable": null,
      "plan": "skipped",
      "tableMatch": "several-tables",
      "parameters": [
        {
          "name": "cart_id",
          "ordinal": 0,
          "type": {
            "name": "uniqueidentifier",
            "maxLength": 16,
            "precision": 0,
            "scale": 0
          },
          "nullable": null,
          "typeSource": "declared"
        }
      ],
      "columns": [
        {
          "ordinal": 0,
          "name": "cart_id",
          "type": {
            "name": "uniqueidentifier",
            "maxLength": 16,
            "precision": 0,
            "scale": 0
          },
          "nullable": false,
          "nullableSource": "server",
          "origin": {
            "schema": "dbo",
            "table": "carts",
            "column": "id"
          },
          "identity": false,
          "computed": false
        },
        {
          "ordinal": 1,
          "name": "customer_id",
          "type": {
            "name": "int",
            "maxLength": 4,
            "precision": 10,
            "scale": 0
          },
          "nullable": true,
          "nullableSource": "server",
          "origin": {
            "schema": "dbo",
            "table": "carts",
            "column": "customer_id"
          },
          "identity": false,
          "computed": false
        },
        {
          "ordinal": 2,
          "name": "created_at",
          "type": {
            "name": "datetime2(0)",
            "maxLength": 6,
            "precision": 19,
            "scale": 0
          },
          "nullable": false,
          "nullableSource": "server",
          "origin": {
            "schema": "dbo",
            "table": "carts",
            "column": "created_at"
          },
          "identity": false,
          "computed": false
        },
        {
          "ordinal": 3,
          "name": "checked_out_at",
          "type": {
            "name": "datetime2(0)",
            "maxLength": 6,
            "precision": 19,
            "scale": 0
          },
          "nullable": true,
          "nullableSource": "server",
          "origin": {
            "schema": "dbo",
            "table": "carts",
            "column": "checked_out_at"
          },
          "identity": false,
          "computed": false
        },
        {
          "ordinal": 4,
          "name": "product_id",
          "type": {
            "name": "int",
            "maxLength": 4,
            "precision": 10,
            "scale": 0
          },
          "nullable": true,
          "nullableSource": "server",
          "origin": {
            "schema": "dbo",
            "table": "cart_items",
            "column": "product_id"
          },
          "identity": false,
          "computed": false
        },
        {
          "ordinal": 5,
          "name": "sku",
          "type": {
            "name": "varchar(20)",
            "maxLength": 20,
            "precision": 0,
            "scale": 0
          },
          "nullable": true,
          "nullableSource": "server",
          "origin": {
            "schema": "dbo",
            "table": "products",
            "column": "sku"
          },
          "identity": false,
          "computed": false
        },
        {
          "ordinal": 6,
          "name": "product_name",
          "type": {
            "name": "nvarchar(100)",
            "maxLength": 200,
            "precision": 0,
            "scale": 0
          },
          "nullable": true,
          "nullableSource": "server",
          "origin": {
            "schema": "dbo",
            "table": "products",
            "column": "name"
          },
          "identity": false,
          "computed": false
        },
        {
          "ordinal": 7,
          "name": "quantity",
          "type": {
            "name": "int",
            "maxLength": 4,
            "precision": 10,
            "scale": 0
          },
          "nullable": true,
          "nullableSource": "server",
          "origin": {
            "schema": "dbo",
            "table": "cart_items",
            "column": "quantity"
          },
          "identity": false,
          "computed": false
        },
        {
          "ordinal": 8,
          "name": "added_at",
          "type": {
            "name": "datetime2(0)",
            "maxLength": 6,
            "precision": 19,
            "scale": 0
          },
          "nullable": true,
          "nullableSource": "server",
          "origin": {
            "schema": "dbo",
            "table": "cart_items",
            "column": "added_at"
          },
          "identity": false,
          "computed": false
        }
      ]
    }
  }
}
