{
  "_WARNING": "This file was generated by the 'dotnet sqlsource' tool.  Do not edit by hand; use the tool to regenerate it.",
  "$schema": "https://raw.githubusercontent.com/mbcrawfo/SqlSource/main/schemas/sidecar-v1.schema.json",
  "formatVersion": 1,
  "toolVersion": "fixture",
  "queries": {
    "WalkNested": {
      "hash": "0e4c77415660df068d6e6c1759ab6bab04118c3b559f16ebc4b958205f923c4d",
      "engine": "postgres",
      "database": "postgres",
      "serverVersion": "18.4",
      "resultKind": "rows",
      "matchesTable": null,
      "plan": "walked",
      "tableMatch": "several-tables",
      "parameters": [],
      "columns": [
        {
          "ordinal": 0,
          "name": "id",
          "type": {
            "name": "integer",
            "kind": "base",
            "schema": "pg_catalog",
            "internalName": "int4"
          },
          "nullable": false,
          "nullableSource": "catalog",
          "origin": {
            "schema": "public",
            "table": "users",
            "column": "id"
          },
          "identity": true,
          "computed": false
        },
        {
          "ordinal": 1,
          "name": "total",
          "type": {
            "name": "numeric(18,2)",
            "kind": "base",
            "schema": "pg_catalog",
            "internalName": "numeric",
            "precision": 18,
            "scale": 2
          },
          "nullable": true,
          "nullableSource": "outer-join",
          "origin": {
            "schema": "public",
            "table": "orders",
            "column": "total"
          },
          "identity": false,
          "computed": false
        },
        {
          "ordinal": 2,
          "name": "amount",
          "type": {
            "name": "numeric(18,2)",
            "kind": "base",
            "schema": "pg_catalog",
            "internalName": "numeric",
            "precision": 18,
            "scale": 2
          },
          "nullable": true,
          "nullableSource": "outer-join",
          "origin": {
            "schema": "billing",
            "table": "invoices",
            "column": "amount"
          },
          "identity": false,
          "computed": false
        }
      ]
    }
  }
}
