{
  "_WARNING": "This file was generated by the 'dotnet sqlsource' tool.  Do not edit by hand; use the tool to regenerate it.",
  "$schema": "https://raw.githubusercontent.com/mbcrawfo/SqlSource/main/schemas/sidecar-v1.schema.json",
  "formatVersion": 1,
  "toolVersion": "0.1.0",
  "queries": {
    "ListOrderStatusLabels": {
      "hash": "de5193199f22761a0c753894c8f38d2325fa731bab68306af0256369637cf1fa",
      "engine": "mssql",
      "database": "realistic",
      "serverVersion": "17.0.5015.4",
      "resultKind": "rows",
      "matchesTable": null,
      "plan": "skipped",
      "tableMatch": "no-origin",
      "parameters": [],
      "columns": [
        {
          "ordinal": 0,
          "name": "id",
          "type": {
            "name": "int",
            "maxLength": 4,
            "precision": 10,
            "scale": 0
          },
          "nullable": false,
          "nullableSource": "server",
          "origin": {
            "schema": "dbo",
            "table": "orders",
            "column": "id"
          },
          "identity": true,
          "computed": false
        },
        {
          "ordinal": 1,
          "name": "placed_at",
          "type": {
            "name": "datetime2(0)",
            "maxLength": 6,
            "precision": 19,
            "scale": 0
          },
          "nullable": false,
          "nullableSource": "server",
          "origin": {
            "schema": "dbo",
            "table": "orders",
            "column": "placed_at"
          },
          "identity": false,
          "computed": false
        },
        {
          "ordinal": 2,
          "name": "status",
          "type": {
            "name": "varchar(10)",
            "maxLength": 10,
            "precision": 0,
            "scale": 0
          },
          "nullable": false,
          "nullableSource": "server",
          "origin": {
            "schema": "dbo",
            "table": "orders",
            "column": "status"
          },
          "identity": false,
          "computed": false
        },
        {
          "ordinal": 3,
          "name": "status_label",
          "type": {
            "name": "nvarchar(16)",
            "maxLength": 32,
            "precision": 0,
            "scale": 0
          },
          "nullable": false,
          "nullableSource": "server",
          "origin": null,
          "identity": false,
          "computed": true
        },
        {
          "ordinal": 4,
          "name": "action_hint",
          "type": {
            "name": "nvarchar(14)",
            "maxLength": 28,
            "precision": 0,
            "scale": 0
          },
          "nullable": true,
          "nullableSource": "server",
          "origin": null,
          "identity": false,
          "computed": true
        },
        {
          "ordinal": 5,
          "name": "days_to_ship",
          "type": {
            "name": "int",
            "maxLength": 4,
            "precision": 10,
            "scale": 0
          },
          "nullable": true,
          "nullableSource": "server",
          "origin": null,
          "identity": false,
          "computed": true
        },
        {
          "ordinal": 6,
          "name": "ship_to",
          "type": {
            "name": "nvarchar(50)",
            "maxLength": 100,
            "precision": 0,
            "scale": 0
          },
          "nullable": true,
          "nullableSource": "server",
          "origin": null,
          "identity": false,
          "computed": true
        },
        {
          "ordinal": 7,
          "name": "is_open",
          "type": {
            "name": "bit",
            "maxLength": 1,
            "precision": 1,
            "scale": 0
          },
          "nullable": true,
          "nullableSource": "server",
          "origin": null,
          "identity": false,
          "computed": true
        }
      ]
    }
  }
}
