{
  "_WARNING": "This file was generated by the 'dotnet sqlsource' tool.  Do not edit by hand; use the tool to regenerate it.",
  "$schema": "https://raw.githubusercontent.com/mbcrawfo/SqlSource/main/schemas/sidecar-v1.schema.json",
  "formatVersion": 1,
  "toolVersion": "fixture",
  "queries": {
    "WalkCube": {
      "hash": "a43ed3dd0a7b3cd90afda7a28e3e55ac0aceaf7aab72bcd27f50f3a2c829bada",
      "engine": "postgres",
      "database": "postgres",
      "serverVersion": "18.4",
      "resultKind": "rows",
      "matchesTable": null,
      "plan": "unavailable",
      "tableMatch": "no-origin",
      "parameters": [],
      "columns": [
        {
          "ordinal": 0,
          "name": "status",
          "type": {
            "name": "public.user_status",
            "kind": "enum",
            "schema": "public",
            "internalName": "user_status",
            "labels": [
              "active",
              "disabled"
            ]
          },
          "nullable": true,
          "nullableSource": "heuristic",
          "origin": {
            "schema": "public",
            "table": "users",
            "column": "status"
          },
          "identity": false,
          "computed": false
        },
        {
          "ordinal": 1,
          "name": "name",
          "type": {
            "name": "character varying(100)",
            "kind": "base",
            "schema": "pg_catalog",
            "internalName": "varchar",
            "length": 100
          },
          "nullable": true,
          "nullableSource": "heuristic",
          "origin": {
            "schema": "public",
            "table": "users",
            "column": "name"
          },
          "identity": false,
          "computed": false
        },
        {
          "ordinal": 2,
          "name": "n",
          "type": {
            "name": "bigint",
            "kind": "base",
            "schema": "pg_catalog",
            "internalName": "int8"
          },
          "nullable": null,
          "nullableSource": "no-origin",
          "origin": null,
          "identity": null,
          "computed": null
        }
      ]
    }
  }
}
