{
  "_WARNING": "This file was generated by the 'dotnet sqlsource' tool.  Do not edit by hand; use the tool to regenerate it.",
  "$schema": "https://raw.githubusercontent.com/mbcrawfo/SqlSource/main/schemas/sidecar-v1.schema.json",
  "formatVersion": 1,
  "toolVersion": "0.1.0",
  "queries": {
    "ListAccountsWithLatestOrderAndInvoice": {
      "hash": "e603f4a3ef496a791607eef482243bf0fe1c8b0ba7bbc60a2856336191223e43",
      "engine": "postgres",
      "database": "realistic",
      "serverVersion": "18.6",
      "resultKind": "rows",
      "matchesTable": null,
      "plan": "walked",
      "tableMatch": "several-tables",
      "parameters": [],
      "columns": [
        {
          "ordinal": 0,
          "name": "id",
          "type": {
            "name": "integer",
            "kind": "base",
            "schema": "pg_catalog",
            "internalName": "int4"
          },
          "nullable": false,
          "nullableSource": "catalog",
          "origin": {
            "schema": "public",
            "table": "accounts",
            "column": "id"
          },
          "identity": true,
          "computed": false
        },
        {
          "ordinal": 1,
          "name": "name",
          "type": {
            "name": "character varying(100)",
            "kind": "base",
            "schema": "pg_catalog",
            "internalName": "varchar",
            "length": 100
          },
          "nullable": false,
          "nullableSource": "catalog",
          "origin": {
            "schema": "public",
            "table": "accounts",
            "column": "name"
          },
          "identity": false,
          "computed": false
        },
        {
          "ordinal": 2,
          "name": "order_id",
          "type": {
            "name": "bigint",
            "kind": "base",
            "schema": "pg_catalog",
            "internalName": "int8"
          },
          "nullable": true,
          "nullableSource": "outer-join",
          "origin": {
            "schema": "public",
            "table": "orders",
            "column": "id"
          },
          "identity": true,
          "computed": false
        },
        {
          "ordinal": 3,
          "name": "placed_at",
          "type": {
            "name": "timestamp with time zone",
            "kind": "base",
            "schema": "pg_catalog",
            "internalName": "timestamptz"
          },
          "nullable": true,
          "nullableSource": "outer-join",
          "origin": {
            "schema": "public",
            "table": "orders",
            "column": "placed_at"
          },
          "identity": false,
          "computed": false
        },
        {
          "ordinal": 4,
          "name": "shipped_at",
          "type": {
            "name": "timestamp with time zone",
            "kind": "base",
            "schema": "pg_catalog",
            "internalName": "timestamptz"
          },
          "nullable": true,
          "nullableSource": "outer-join",
          "origin": {
            "schema": "public",
            "table": "orders",
            "column": "shipped_at"
          },
          "identity": false,
          "computed": false
        },
        {
          "ordinal": 5,
          "name": "amount",
          "type": {
            "name": "public.positive_amount",
            "kind": "domain",
            "schema": "public",
            "internalName": "positive_amount",
            "base": {
              "name": "numeric(12,2)",
              "kind": "base",
              "schema": "pg_catalog",
              "internalName": "numeric",
              "precision": 12,
              "scale": 2
            }
          },
          "nullable": true,
          "nullableSource": "outer-join",
          "origin": {
            "schema": "billing",
            "table": "invoices",
            "column": "amount"
          },
          "identity": false,
          "computed": false
        }
      ]
    }
  }
}
