{
  "_WARNING": "This file was generated by the 'dotnet sqlsource' tool.  Do not edit by hand; use the tool to regenerate it.",
  "$schema": "https://raw.githubusercontent.com/mbcrawfo/SqlSource/main/schemas/sidecar-v1.schema.json",
  "formatVersion": 1,
  "toolVersion": "0.1.0",
  "queries": {
    "GetOrderReport": {
      "hash": "51f4cccae24f0639179c22190a34903bad7d21f33d2b26ca1b88c5d1c753b76f",
      "engine": "postgres",
      "database": "realistic",
      "serverVersion": "18.6",
      "resultKind": "rows",
      "matchesTable": null,
      "plan": "walked",
      "tableMatch": "no-origin",
      "parameters": [
        {
          "name": "from",
          "ordinal": 0,
          "type": {
            "name": "timestamp with time zone",
            "bindName": "timestamp with time zone",
            "kind": "base",
            "schema": "pg_catalog",
            "internalName": "timestamptz"
          },
          "nullable": null,
          "typeSource": "inferred"
        },
        {
          "name": "to",
          "ordinal": 1,
          "type": {
            "name": "timestamp with time zone",
            "bindName": "timestamp with time zone",
            "kind": "base",
            "schema": "pg_catalog",
            "internalName": "timestamptz"
          },
          "nullable": null,
          "typeSource": "inferred"
        }
      ],
      "columns": [
        {
          "ordinal": 0,
          "name": "order_id",
          "type": {
            "name": "bigint",
            "kind": "base",
            "schema": "pg_catalog",
            "internalName": "int8"
          },
          "nullable": false,
          "nullableSource": "catalog",
          "origin": {
            "schema": "public",
            "table": "orders",
            "column": "id"
          },
          "identity": true,
          "computed": false
        },
        {
          "ordinal": 1,
          "name": "placed_at",
          "type": {
            "name": "timestamp with time zone",
            "kind": "base",
            "schema": "pg_catalog",
            "internalName": "timestamptz"
          },
          "nullable": false,
          "nullableSource": "catalog",
          "origin": {
            "schema": "public",
            "table": "orders",
            "column": "placed_at"
          },
          "identity": false,
          "computed": false
        },
        {
          "ordinal": 2,
          "name": "note",
          "type": {
            "name": "text",
            "kind": "base",
            "schema": "pg_catalog",
            "internalName": "text"
          },
          "nullable": true,
          "nullableSource": "catalog",
          "origin": {
            "schema": "public",
            "table": "orders",
            "column": "note"
          },
          "identity": false,
          "computed": false
        },
        {
          "ordinal": 3,
          "name": "account_name",
          "type": {
            "name": "character varying(100)",
            "kind": "base",
            "schema": "pg_catalog",
            "internalName": "varchar",
            "length": 100
          },
          "nullable": false,
          "nullableSource": "catalog",
          "origin": {
            "schema": "public",
            "table": "accounts",
            "column": "name"
          },
          "identity": false,
          "computed": false
        },
        {
          "ordinal": 4,
          "name": "line_no",
          "type": {
            "name": "integer",
            "kind": "base",
            "schema": "pg_catalog",
            "internalName": "int4"
          },
          "nullable": false,
          "nullableSource": "catalog",
          "origin": {
            "schema": "public",
            "table": "order_lines",
            "column": "line_no"
          },
          "identity": false,
          "computed": false
        },
        {
          "ordinal": 5,
          "name": "sku",
          "type": {
            "name": "text",
            "kind": "base",
            "schema": "pg_catalog",
            "internalName": "text"
          },
          "nullable": false,
          "nullableSource": "catalog",
          "origin": {
            "schema": "public",
            "table": "products",
            "column": "sku"
          },
          "identity": false,
          "computed": false
        },
        {
          "ordinal": 6,
          "name": "product_name",
          "type": {
            "name": "text",
            "kind": "base",
            "schema": "pg_catalog",
            "internalName": "text"
          },
          "nullable": false,
          "nullableSource": "catalog",
          "origin": {
            "schema": "public",
            "table": "products",
            "column": "name"
          },
          "identity": false,
          "computed": false
        },
        {
          "ordinal": 7,
          "name": "category",
          "type": {
            "name": "text",
            "kind": "base",
            "schema": "pg_catalog",
            "internalName": "text"
          },
          "nullable": true,
          "nullableSource": "outer-join",
          "origin": {
            "schema": "public",
            "table": "categories",
            "column": "name"
          },
          "identity": false,
          "computed": false
        },
        {
          "ordinal": 8,
          "name": "line_total",
          "type": {
            "name": "numeric",
            "kind": "base",
            "schema": "pg_catalog",
            "internalName": "numeric"
          },
          "nullable": null,
          "nullableSource": "no-origin",
          "origin": null,
          "identity": null,
          "computed": null
        },
        {
          "ordinal": 9,
          "name": "invoiced",
          "type": {
            "name": "public.positive_amount",
            "kind": "domain",
            "schema": "public",
            "internalName": "positive_amount",
            "base": {
              "name": "numeric(12,2)",
              "kind": "base",
              "schema": "pg_catalog",
              "internalName": "numeric",
              "precision": 12,
              "scale": 2
            }
          },
          "nullable": true,
          "nullableSource": "outer-join",
          "origin": {
            "schema": "billing",
            "table": "invoices",
            "column": "amount"
          },
          "identity": false,
          "computed": false
        },
        {
          "ordinal": 10,
          "name": "paid_on",
          "type": {
            "name": "date",
            "kind": "base",
            "schema": "pg_catalog",
            "internalName": "date"
          },
          "nullable": true,
          "nullableSource": "outer-join",
          "origin": {
            "schema": "billing",
            "table": "invoices",
            "column": "paid_on"
          },
          "identity": false,
          "computed": false
        }
      ]
    }
  }
}
