{
  "_WARNING": "This file was generated by the 'dotnet sqlsource' tool.  Do not edit by hand; use the tool to regenerate it.",
  "$schema": "https://raw.githubusercontent.com/mbcrawfo/SqlSource/main/schemas/sidecar-v1.schema.json",
  "formatVersion": 1,
  "toolVersion": "0.1.0",
  "queries": {
    "ListCustomerPayments": {
      "hash": "2eb21efc4aaf6f5aa7bc9a4105c7361ca6d4e74969f4acd83434075e6ffe18d8",
      "engine": "mssql",
      "database": "realistic",
      "serverVersion": "17.0.5015.4",
      "resultKind": "rows",
      "matchesTable": null,
      "plan": "skipped",
      "tableMatch": "no-origin",
      "parameters": [
        {
          "name": "customer_id",
          "ordinal": 0,
          "type": {
            "name": "int",
            "maxLength": 4,
            "precision": 10,
            "scale": 0
          },
          "nullable": null,
          "typeSource": "declared"
        }
      ],
      "columns": [
        {
          "ordinal": 0,
          "name": "id",
          "type": {
            "name": "int",
            "maxLength": 4,
            "precision": 10,
            "scale": 0
          },
          "nullable": false,
          "nullableSource": "server",
          "origin": {
            "schema": "billing",
            "table": "payments",
            "column": "id"
          },
          "identity": true,
          "computed": false
        },
        {
          "ordinal": 1,
          "name": "paid_at",
          "type": {
            "name": "datetime2(0)",
            "maxLength": 6,
            "precision": 19,
            "scale": 0
          },
          "nullable": false,
          "nullableSource": "server",
          "origin": {
            "schema": "billing",
            "table": "payments",
            "column": "paid_at"
          },
          "identity": false,
          "computed": false
        },
        {
          "ordinal": 2,
          "name": "invoice_number",
          "type": {
            "name": "int",
            "maxLength": 4,
            "precision": 10,
            "scale": 0
          },
          "nullable": false,
          "nullableSource": "server",
          "origin": {
            "schema": "billing",
            "table": "invoices",
            "column": "number"
          },
          "identity": false,
          "computed": false
        },
        {
          "ordinal": 3,
          "name": "method",
          "type": {
            "name": "varchar(10)",
            "maxLength": 10,
            "precision": 0,
            "scale": 0
          },
          "nullable": false,
          "nullableSource": "server",
          "origin": {
            "schema": "billing",
            "table": "payments",
            "column": "method"
          },
          "identity": false,
          "computed": false
        },
        {
          "ordinal": 4,
          "name": "reference",
          "type": {
            "name": "nvarchar(50)",
            "maxLength": 100,
            "precision": 0,
            "scale": 0
          },
          "nullable": true,
          "nullableSource": "server",
          "origin": {
            "schema": "billing",
            "table": "payments",
            "column": "reference"
          },
          "identity": false,
          "computed": false
        },
        {
          "ordinal": 5,
          "name": "amount",
          "type": {
            "name": "money",
            "maxLength": 8,
            "precision": 19,
            "scale": 4
          },
          "nullable": false,
          "nullableSource": "server",
          "origin": {
            "schema": "billing",
            "table": "payments",
            "column": "amount"
          },
          "identity": false,
          "computed": false
        },
        {
          "ordinal": 6,
          "name": "paid_to_date",
          "type": {
            "name": "money",
            "maxLength": 8,
            "precision": 19,
            "scale": 4
          },
          "nullable": true,
          "nullableSource": "server",
          "origin": null,
          "identity": false,
          "computed": false
        }
      ]
    }
  }
}
