{
  "_WARNING": "This file was generated by the 'dotnet sqlsource' tool.  Do not edit by hand; use the tool to regenerate it.",
  "$schema": "https://raw.githubusercontent.com/mbcrawfo/SqlSource/main/schemas/sidecar-v1.schema.json",
  "formatVersion": 1,
  "toolVersion": "0.1.0",
  "queries": {
    "ListCustomersWithOrdersAndOpenCarts": {
      "hash": "9ee40dd55e7204feed27b8a85569f233407d8596fe419c1b59a91088ce482a79",
      "engine": "mssql",
      "database": "realistic",
      "serverVersion": "17.0.5015.4",
      "resultKind": "rows",
      "matchesTable": null,
      "plan": "skipped",
      "tableMatch": "columns-differ",
      "parameters": [],
      "columns": [
        {
          "ordinal": 0,
          "name": "id",
          "type": {
            "name": "int",
            "maxLength": 4,
            "precision": 10,
            "scale": 0
          },
          "nullable": false,
          "nullableSource": "server",
          "origin": {
            "schema": "dbo",
            "table": "customers",
            "column": "id"
          },
          "identity": true,
          "computed": false
        },
        {
          "ordinal": 1,
          "name": "name",
          "type": {
            "name": "nvarchar(100)",
            "maxLength": 200,
            "precision": 0,
            "scale": 0
          },
          "nullable": false,
          "nullableSource": "server",
          "origin": {
            "schema": "dbo",
            "table": "customers",
            "column": "name"
          },
          "identity": false,
          "computed": false
        },
        {
          "ordinal": 2,
          "name": "email",
          "type": {
            "name": "nvarchar(254)",
            "maxLength": 508,
            "precision": 0,
            "scale": 0,
            "userType": {
              "schema": "dbo",
              "name": "Email"
            }
          },
          "nullable": true,
          "nullableSource": "server",
          "origin": {
            "schema": "dbo",
            "table": "customers",
            "column": "email"
          },
          "identity": false,
          "computed": false
        },
        {
          "ordinal": 3,
          "name": "time_zone",
          "type": {
            "name": "varchar(50)",
            "maxLength": 50,
            "precision": 0,
            "scale": 0
          },
          "nullable": true,
          "nullableSource": "server",
          "origin": {
            "schema": "dbo",
            "table": "customers",
            "column": "time_zone"
          },
          "identity": false,
          "computed": false
        }
      ]
    }
  }
}
