{
  "_WARNING": "This file was generated by the 'dotnet sqlsource' tool.  Do not edit by hand; use the tool to regenerate it.",
  "$schema": "https://raw.githubusercontent.com/mbcrawfo/SqlSource/main/schemas/sidecar-v1.schema.json",
  "formatVersion": 1,
  "toolVersion": "0.1.0",
  "queries": {
    "ListAccountsByLastOrder": {
      "hash": "1b11abb24f056d6e226c70858975837ddb8ac97bafdde2f08afe0adcdcb40f30",
      "engine": "postgres",
      "database": "realistic",
      "serverVersion": "18.6",
      "resultKind": "rows",
      "matchesTable": null,
      "plan": "walked",
      "tableMatch": "no-origin",
      "parameters": [],
      "columns": [
        {
          "ordinal": 0,
          "name": "id",
          "type": {
            "name": "integer",
            "kind": "base",
            "schema": "pg_catalog",
            "internalName": "int4"
          },
          "nullable": false,
          "nullableSource": "catalog",
          "origin": {
            "schema": "public",
            "table": "accounts",
            "column": "id"
          },
          "identity": true,
          "computed": false
        },
        {
          "ordinal": 1,
          "name": "name",
          "type": {
            "name": "character varying(100)",
            "kind": "base",
            "schema": "pg_catalog",
            "internalName": "varchar",
            "length": 100
          },
          "nullable": false,
          "nullableSource": "catalog",
          "origin": {
            "schema": "public",
            "table": "accounts",
            "column": "name"
          },
          "identity": false,
          "computed": false
        },
        {
          "ordinal": 2,
          "name": "status",
          "type": {
            "name": "public.account_status",
            "kind": "enum",
            "schema": "public",
            "internalName": "account_status",
            "labels": [
              "active",
              "suspended",
              "closed"
            ]
          },
          "nullable": false,
          "nullableSource": "catalog",
          "origin": {
            "schema": "public",
            "table": "accounts",
            "column": "status"
          },
          "identity": false,
          "computed": false
        },
        {
          "ordinal": 3,
          "name": "last_placed_at",
          "type": {
            "name": "timestamp with time zone",
            "kind": "base",
            "schema": "pg_catalog",
            "internalName": "timestamptz"
          },
          "nullable": null,
          "nullableSource": "no-origin",
          "origin": null,
          "identity": null,
          "computed": null
        },
        {
          "ordinal": 4,
          "name": "first_note",
          "type": {
            "name": "text",
            "kind": "base",
            "schema": "pg_catalog",
            "internalName": "text"
          },
          "nullable": null,
          "nullableSource": "no-origin",
          "origin": null,
          "identity": null,
          "computed": null
        },
        {
          "ordinal": 5,
          "name": "order_count",
          "type": {
            "name": "bigint",
            "kind": "base",
            "schema": "pg_catalog",
            "internalName": "int8"
          },
          "nullable": null,
          "nullableSource": "no-origin",
          "origin": null,
          "identity": null,
          "computed": null
        }
      ]
    }
  }
}
