{
  "_WARNING": "This file was generated by the 'dotnet sqlsource' tool.  Do not edit by hand; use the tool to regenerate it.",
  "$schema": "https://raw.githubusercontent.com/mbcrawfo/SqlSource/main/schemas/sidecar-v1.schema.json",
  "formatVersion": 1,
  "toolVersion": "0.1.0",
  "queries": {
    "ListProductAttributes": {
      "hash": "6ab564167b2ebc555acb1eeb3dea83286be56434149f50515012fdd63e0cce89",
      "engine": "mssql",
      "database": "realistic",
      "serverVersion": "17.0.5015.4",
      "resultKind": "rows",
      "matchesTable": null,
      "plan": "skipped",
      "tableMatch": "no-origin",
      "parameters": [],
      "columns": [
        {
          "ordinal": 0,
          "name": "id",
          "type": {
            "name": "int",
            "maxLength": 4,
            "precision": 10,
            "scale": 0
          },
          "nullable": false,
          "nullableSource": "server",
          "origin": {
            "schema": "dbo",
            "table": "products",
            "column": "id"
          },
          "identity": true,
          "computed": false
        },
        {
          "ordinal": 1,
          "name": "sku",
          "type": {
            "name": "varchar(20)",
            "maxLength": 20,
            "precision": 0,
            "scale": 0
          },
          "nullable": false,
          "nullableSource": "server",
          "origin": {
            "schema": "dbo",
            "table": "products",
            "column": "sku"
          },
          "identity": false,
          "computed": false
        },
        {
          "ordinal": 2,
          "name": "name",
          "type": {
            "name": "nvarchar(100)",
            "maxLength": 200,
            "precision": 0,
            "scale": 0
          },
          "nullable": false,
          "nullableSource": "server",
          "origin": {
            "schema": "dbo",
            "table": "products",
            "column": "name"
          },
          "identity": false,
          "computed": false
        },
        {
          "ordinal": 3,
          "name": "color",
          "type": {
            "name": "nvarchar(30)",
            "maxLength": 60,
            "precision": 0,
            "scale": 0
          },
          "nullable": true,
          "nullableSource": "server",
          "origin": null,
          "identity": false,
          "computed": false
        },
        {
          "ordinal": 4,
          "name": "weight_kg",
          "type": {
            "name": "decimal(4,2)",
            "maxLength": 5,
            "precision": 4,
            "scale": 2
          },
          "nullable": true,
          "nullableSource": "server",
          "origin": null,
          "identity": false,
          "computed": false
        },
        {
          "ordinal": 5,
          "name": "ports",
          "type": {
            "name": "int",
            "maxLength": 4,
            "precision": 10,
            "scale": 0
          },
          "nullable": true,
          "nullableSource": "server",
          "origin": null,
          "identity": false,
          "computed": false
        },
        {
          "ordinal": 6,
          "name": "sizes",
          "type": {
            "name": "nvarchar(max)",
            "maxLength": -1,
            "precision": 0,
            "scale": 0
          },
          "nullable": true,
          "nullableSource": "server",
          "origin": null,
          "identity": false,
          "computed": false
        }
      ]
    }
  }
}
